{"format":"erg-scene/2","stem":"mymaps_objects","title":"Synthetic Brawl","base":{"key":"Multi.Synthetic","source":"game","file":"Synthetic","sha256":{"xan":"aaaaaaaaaaaaaaaaaaaaaaaaaaaaaaaaaaaaaaaaaaaaaaaaaaaaaaaaaaaaaaaa","xom":"bbbbbbbbbbbbbbbbbbbbbbbbbbbbbbbbbbbbbbbbbbbbbbbbbbbbbbbbbbbbbbbb","hmp":"cccccccccccccccccccccccccccccccccccccccccccccccccccccccccccccccc"}},"registry":{"levelType":0,"themeType":5,"scripts":["stdvs","wormpot"],"previewType":0},"kind":{"survivor":true},"databank":{"theme":"CAMELOT","timeOfDay":"DAY","materialFile":"ThemeBuilding\\ThemeBuilding.txt","heightmapBase":"","heightmapSecond":""},"water":{"level":40},"spawns":{"mode":"knots"},"hmp":{"mode":"paint","ref":26},"units":{"worldPerXan":20},"frames":[{"id":1,"parent":null,"name":"root","pos":[0,0,0],"rot":[0,0,0],"scale":[1,1,1],"size":[0,0,0],"voxels":null,"heightMap":null,"folder":false},{"id":2,"parent":1,"name":"Worms","pos":[0,0,0],"rot":[0,0,0],"scale":[1,1,1],"size":[1,1,1],"voxels":null,"heightMap":null,"folder":true},{"id":3,"parent":1,"name":"Objects","pos":[2,0,-2],"rot":[0,0,0],"scale":[1,1,1],"size":[1,1,1],"voxels":null,"heightMap":null,"folder":true},{"id":4,"parent":1,"name":"land0","pos":[-104.5,18.25,45],"rot":[0,5.824,0.25],"scale":[1.5,1.5,1.5],"size":[7,2,11],"voxels":1,"heightMap":2,"folder":false},{"id":5,"parent":1,"name":"land1","pos":[-178.75,1.5,193.5],"rot":[0,6.112,0],"scale":[1,1,1],"size":[2,7,4],"voxels":3,"heightMap":4,"folder":false},{"id":6,"parent":1,"name":"land2","pos":[42,15.5,112],"rot":[0,2.6270000000000002,0],"scale":[1,1,1],"size":[7,9,12],"voxels":5,"heightMap":6,"folder":false},{"id":7,"parent":1,"name":"land3","pos":[-7.5,1.75,99.75],"rot":[0,5.2410000000000005,0],"scale":[1,1,1],"size":[11,2,6],"voxels":7,"heightMap":8,"folder":false},{"id":8,"parent":7,"name":"land4","pos":[-151.25,9,-17.5],"rot":[0,0.679,0],"scale":[1,1,1],"size":[12,3,11],"voxels":9,"heightMap":10,"folder":false},{"id":9,"parent":1,"name":"land5","pos":[-166.25,12,170.5],"rot":[0,1.67,0],"scale":[1,1,1],"size":[6,4,3],"voxels":11,"heightMap":12,"folder":false},{"id":10,"parent":1,"name":"land6","pos":[5,14.25,-76],"rot":[0,0.994,0],"scale":[1,1,1],"size":[10,10,12],"voxels":13,"heightMap":14,"folder":false},{"id":11,"parent":1,"name":"land7","pos":[198.5,9.75,-128.75],"rot":[0,1.594,0.25],"scale":[1,1,1],"size":[7,4,3],"voxels":15,"heightMap":16,"folder":false},{"id":12,"parent":1,"name":"land8","pos":[-130,8.75,-128.5],"rot":[0,0.013000000000000001,0],"scale":[1,1,1],"size":[12,10,4],"voxels":17,"heightMap":18,"folder":false},{"id":13,"parent":12,"name":"land9","pos":[17.25,14.75,153.25],"rot":[0,2.333,0],"scale":[1,1,1],"size":[10,9,10],"voxels":19,"heightMap":20,"folder":false},{"id":14,"parent":1,"name":"land10","pos":[1.5,9.75,114.25],"rot":[0,6.014,0],"scale":[1,1,1],"size":[2,3,10],"voxels":21,"heightMap":22,"folder":false},{"id":15,"parent":1,"name":"land11","pos":[-89,19,86],"rot":[0,1.312,0],"scale":[1.5,1.5,1.5],"size":[10,2,4],"voxels":23,"heightMap":24,"folder":false},{"id":1000,"parent":1,"name":"Scene","pos":[0,0,0],"rot":[0,0,0],"scale":[1,1,1],"size":[0,0,0],"voxels":null,"heightMap":null,"folder":false},{"id":-1,"new":true,"parent":1000,"name":"ergframe_0","pos":[4,2,-3],"rot":[0,0,0],"scale":[1,1,1],"size":[6,31,6],"voxels":25,"heightMap":null,"folder":false}],"details":[{"id":16,"src":16,"frame":2,"name":"WORM0","resource":"CheesyGrinWorm","pos":[12.5,3,-4],"rot":[0,0,0],"scale":[1,1,1],"voxelPos":[0,0,0],"role":"spawn"},{"id":17,"src":17,"frame":2,"name":"WORM1","resource":"CheesyGrinWorm","pos":[2,10,51.5],"rot":[0,0,0],"scale":[1,1,1],"voxelPos":[0,0,0],"role":"spawn"},{"id":18,"src":18,"frame":2,"name":"WORM2","resource":"CheesyGrinWorm","pos":[-16.5,10,-34],"rot":[0,0,0],"scale":[1,1,1],"voxelPos":[0,0,0],"role":"spawn"},{"id":19,"src":19,"frame":2,"name":"WORM3","resource":"CheesyGrinWorm","pos":[-29.5,10,-59],"rot":[0,0,0],"scale":[1,1,1],"voxelPos":[0,0,0],"role":"spawn"},{"id":20,"src":20,"frame":2,"name":"WORM4","resource":"CheesyGrinWorm","pos":[74,10,-59],"rot":[0,0,0],"scale":[1,1,1],"voxelPos":[0,0,0],"role":"spawn"},{"id":21,"src":21,"frame":2,"name":"WORM5","resource":"CheesyGrinWorm","pos":[36,10,40],"rot":[0,0,0],"scale":[1,1,1],"voxelPos":[0,0,0],"role":"spawn"},{"id":22,"src":22,"frame":2,"name":"WORM6","resource":"CheesyGrinWorm","pos":[-12,10,-46.5],"rot":[0,0,0],"scale":[1,1,1],"voxelPos":[0,0,0],"role":"spawn"},{"id":23,"src":23,"frame":2,"name":"WORM7","resource":"CheesyGrinWorm","pos":[5,10,-32.5],"rot":[0,0,0],"scale":[1,1,1],"voxelPos":[0,0,0],"role":"spawn"},{"id":24,"src":24,"frame":3,"name":"oildrum","resource":"OilDrum","pos":[5,2,19.5],"rot":[0,0,0],"scale":[1,1,1],"voxelPos":[0,0,0],"role":"object"},{"id":26,"src":26,"frame":3,"name":"Camera1","resource":"Camera","pos":[43,2,38.5],"rot":[0,0,0],"scale":[1,1,1],"voxelPos":[0,0,0],"role":"camera"},{"id":27,"src":27,"frame":3,"name":"LIGHT PNTLGHT 1 1 1 30","resource":"LIGHT","pos":[11.5,2,34.5],"rot":[0,0,0],"scale":[1,1,1],"voxelPos":[0,0,0],"role":"light"},{"id":28,"src":28,"frame":5,"name":"VISIBLE_prop0","resource":"BUILDING1","pos":[2.5,1,0.5],"rot":[0,2.33,0],"scale":[1,1,1],"voxelPos":[1,1,1],"role":"scenery"},{"id":29,"src":29,"frame":8,"name":"VISIBLE_prop1","resource":"BUILDING2","pos":[3.5,1,2.5],"rot":[0,2.68,0],"scale":[1,1,1],"voxelPos":[1,1,1],"role":"scenery"},{"id":30,"src":30,"frame":11,"name":"VISIBLE_prop2","resource":"BUILDING3","pos":[0,1,3],"rot":[0,1.37,0],"scale":[1,1,1],"voxelPos":[1,1,1],"role":"scenery"},{"id":31,"src":null,"frame":3,"name":"oildrum","resource":"OilDrum","pos":[1,2,3],"rot":[0,0,0],"scale":[1,1,1],"voxelPos":[0,0,0],"role":"object"},{"id":32,"src":null,"frame":3,"name":"CRATE_0","resource":"Unit","pos":[0,1,2],"rot":[0,0,0],"scale":[1,1,1],"voxelPos":[0,0,0],"role":"object"},{"id":33,"src":null,"frame":3,"name":"CRATE_1","resource":"Unit","pos":[1,1,2],"rot":[0,0,0],"scale":[1,1,1],"voxelPos":[0,0,0],"role":"object"},{"id":34,"src":null,"frame":3,"name":"CRATE_2","resource":"Unit","pos":[2,1,2],"rot":[0,0,0],"scale":[1,1,1],"voxelPos":[0,0,0],"role":"object"},{"id":35,"src":null,"frame":3,"name":"TP_1_0","resource":"Unit","pos":[3,1,2],"rot":[0,0,0],"scale":[1,1,1],"voxelPos":[0,0,0],"role":"object"},{"id":36,"src":null,"frame":3,"name":"TP_1_1","resource":"Unit","pos":[4,1,2],"rot":[0,0,0],"scale":[1,1,1],"voxelPos":[0,0,0],"role":"object"},{"id":37,"src":null,"frame":3,"name":"TRIG_0","resource":"Unit","pos":[5,1,2],"rot":[0,0,0],"scale":[1,1,1],"voxelPos":[0,0,0],"role":"object"}],"blobs":[{"ref":1,"kind":"voxels","frame":4,"bytes":616},{"ref":2,"kind":"heightMap","frame":4,"bytes":384},{"ref":3,"kind":"voxels","frame":5,"bytes":224},{"ref":4,"kind":"heightMap","frame":5,"bytes":60},{"ref":5,"kind":"voxels","frame":6,"bytes":3024},{"ref":6,"kind":"heightMap","frame":6,"bytes":416},{"ref":7,"kind":"voxels","frame":7,"bytes":528},{"ref":8,"kind":"heightMap","frame":7,"bytes":336},{"ref":9,"kind":"voxels","frame":8,"bytes":1584},{"ref":10,"kind":"heightMap","frame":8,"bytes":624},{"ref":11,"kind":"voxels","frame":9,"bytes":288},{"ref":12,"kind":"heightMap","frame":9,"bytes":112},{"ref":13,"kind":"voxels","frame":10,"bytes":4800},{"ref":14,"kind":"heightMap","frame":10,"bytes":572},{"ref":15,"kind":"voxels","frame":11,"bytes":336},{"ref":16,"kind":"heightMap","frame":11,"bytes":128},{"ref":17,"kind":"voxels","frame":12,"bytes":1920},{"ref":18,"kind":"heightMap","frame":12,"bytes":260},{"ref":19,"kind":"voxels","frame":13,"bytes":3600},{"ref":20,"kind":"heightMap","frame":13,"bytes":484},{"ref":21,"kind":"voxels","frame":14,"bytes":240},{"ref":22,"kind":"heightMap","frame":14,"bytes":132},{"ref":23,"kind":"voxels","frame":15,"bytes":320},{"ref":24,"kind":"heightMap","frame":15,"bytes":220},{"ref":25,"kind":"voxels","frame":-1,"bytes":4464},{"ref":26,"kind":"hmp","frame":0,"bytes":50000}],"objects":[{"knot":"CRATE_0","type":"crate","crate":{"kind":"weapon","contents":"kWeaponHolyHandGrenade","count":1,"hitpoints":25,"parachute":false}},{"knot":"CRATE_1","type":"crate","crate":{"kind":"health","amount":50,"hitpoints":25,"parachute":false}},{"knot":"CRATE_2","type":"crate","crate":{"kind":"utility","contents":"kUtilityJetpack","count":2,"hitpoints":25,"parachute":false}},{"knot":"TP_1_0","type":"telepad","group":1},{"knot":"TP_1_1","type":"telepad","group":1},{"knot":"TRIG_0","type":"trigger","trigger":{"index":1,"radius":60,"teamCollect":0,"teamDestroy":4,"hitpoints":1,"wormCollect":false}}],"script":{"present":true,"sha256":"dddddddddddddddddddddddddddddddddddddddddddddddddddddddddddddddd"}}
